{
  "$schema": "https://json-schema.org/draft/2020-12/schema",
  "title": "Build PPT Deck Spec",
  "type": "object",
  "required": ["title", "slides"],
  "additionalProperties": true,
  "properties": {
    "title": { "type": "string" },
    "subtitle": { "type": "string" },
    "author": { "type": "string" },
    "date": { "type": "string" },
    "theme": {
      "type": "string",
      "enum": ["lime", "ikb", "lemon", "lemon-green", "safety-orange"],
      "default": "lime"
    },
    "slides": {
      "type": "array",
      "minItems": 1,
      "items": {
        "type": "object",
        "required": ["layout", "title"],
        "additionalProperties": true,
        "properties": {
          "layout": {
            "type": "string",
            "enum": ["S01", "S02", "S03", "S04", "S05", "S06", "S07", "S08", "S09", "S10", "S11", "S12", "S13", "S14", "S15", "S16", "S17", "S18", "S19", "S20", "S21", "S22"]
          },
          "title": { "type": "string" },
          "subtitle": { "type": "string" },
          "kicker": { "type": "string" },
          "accent_terms": {
            "oneOf": [
              { "type": "string" },
              { "type": "array", "items": { "type": "string" } }
            ]
          },
          "body": {
            "oneOf": [
              { "type": "string" },
              { "type": "array", "items": { "type": "string" } }
            ]
          },
          "items": {
            "type": "array",
            "items": {
              "oneOf": [
                { "type": "string" },
                {
                  "type": "object",
                  "additionalProperties": true,
                  "properties": {
                    "title": { "type": "string" },
                    "label": { "type": "string" },
                    "body": { "type": "string" },
                    "value": { "type": ["string", "number"] }
                  }
                }
              ]
            }
          },
          "metrics": {
            "type": "array",
            "items": {
              "type": "object",
              "additionalProperties": true,
              "properties": {
                "label": { "type": "string" },
                "value": { "type": ["string", "number"] },
                "unit": { "type": "string" },
                "note": { "type": "string" },
                "max": { "type": "number" }
              }
            }
          },
          "images": {
            "type": "array",
            "items": {
              "oneOf": [
                { "type": "string" },
                {
                  "type": "object",
                  "required": ["path"],
                  "additionalProperties": true,
                  "properties": {
                    "path": { "type": "string" },
                    "caption": { "type": "string" },
                    "fit": { "type": "string", "enum": ["cover", "contain"] }
                  }
                }
              ]
            }
          },
          "notes": {
            "oneOf": [
              { "type": "string" },
              { "type": "array", "items": { "type": "string" } }
            ]
          }
        }
      }
    }
  }
}
